{
  "$schema": "https://json-schema.org/draft/2020-12/schema",
  "$id": "https://bds.local/pact/v1/schemas/packet_base.schema.json",
  "title": "PACT V1 Packet Base",
  "type": "object",
  "required": [
    "schema_version",
    "packet_id",
    "packet_class",
    "packet_revision",
    "request_id",
    "trace_id",
    "consumer_identity",
    "permission_context_digest",
    "source_lineage_digest",
    "serialization_profile",
    "lifecycle_state",
    "freshness_state",
    "admissibility_state",
    "created_at",
    "expires_at",
    "packet_hash",
    "grounding_required",
    "warnings",
    "restrictions"
  ],
  "properties": {
    "schema_version": {
      "type": "string",
      "const": "1.0.0"
    },
    "packet_id": {
      "type": "string"
    },
    "packet_class": {
      "type": "string",
      "enum": [
        "answer_packet",
        "policy_response_packet",
        "search_assist_packet"
      ]
    },
    "packet_revision": {
      "type": "integer",
      "minimum": 1
    },
    "request_id": {
      "type": "string"
    },
    "trace_id": {
      "type": "string"
    },
    "task_intent_id": {
      "type": "string"
    },
    "context_bundle_id": {
      "type": "string"
    },
    "context_bundle_hash": {
      "type": "string",
      "minLength": 8
    },
    "consumer_identity": {
      "type": "string"
    },
    "permission_context_digest": {
      "type": "string",
      "minLength": 16
    },
    "source_lineage_digest": {
      "$ref": "./source_lineage_digest.schema.json"
    },
    "serialization_profile": {
      "$ref": "./serialization_profile_enum.schema.json"
    },
    "lifecycle_state": {
      "type": "string",
      "enum": [
        "compiled",
        "validated",
        "admitted",
        "safe_failed"
      ]
    },
    "freshness_state": {
      "type": "string",
      "enum": [
        "fresh",
        "stale",
        "expired"
      ]
    },
    "admissibility_state": {
      "type": "string",
      "enum": [
        "pending",
        "admissible",
        "inadmissible"
      ]
    },
    "created_at": {
      "type": "string",
      "format": "date-time"
    },
    "expires_at": {
      "type": "string",
      "format": "date-time"
    },
    "packet_hash": {
      "type": "string",
      "minLength": 16
    },
    "grounding_required": {
      "type": "boolean"
    },
    "warnings": {
      "type": "array",
      "items": {
        "type": "string"
      }
    },
    "restrictions": {
      "type": "array",
      "items": {
        "type": "string"
      }
    }
  },
  "description": "Shared base contract for all V1 packet classes."
}